Acronym,DefinitionSFAR-- 38, Special Federal Aviation Regulation 38SHPO, State Historic Preservation OfficerSIC, Service Initiation ChargeSID, Standard Instrument DepartureSID, Station IdentifierSIGMET, Significant Meteorological InformationSIMMOD, Airport and Airspace Simulation ModelSIP, State Implementation PlanSM, Statute MilesSMGC, Surface Movement Guidance and ControlSMPS, Sector Maintenance Processor SubsystemSMS, Safety Management SystemSMS, Simulation Modeling SystemSNR," Signal-- to-- Noise Ratio, also: S/N"SOAR, System of Airports ReportingSOC, Service Oversight CenterSOIR, Simultaneous Operations On Intersecting RunwaysSOIWR, Simultaneous Operations on Intersecting Wet RunwaysSRAP, Sensor Receiver and ProcessorSRM, Safety Risk ManagementSSALF, SSALS with Sequenced FlashersSSALR, Simplified Short Approach Lighting SystemSSB, Single Side BandSTAR, Standard Terminal Arrival RouteSTD, StandardSTMUX, Statistical Data MultiplexerSTOL, Short Takeoff and LandingSURPIC, Surface PictureSVCA, Service ASVCB, Service BSVCC, Service CSVCO, Service OSVFB, Interphone Service F (B)SVFC, Interphone Service F (C)SVFD, Interphone Service F (D)SVFO, Interphone Service F (A)SVFR, Special Visual Flight RulesT1MUX, T1 MultiplexerTAAS, Terminal Advance Automation SystemTAC, Technical Advisory CommitteeTACAN, Tactical Aircraft Control and NavigationTACR," TACAN at VOR, TACAN only"TAF," Terminal Area Forecast, Terminal Aerodrome Forecast"TARS, Terminal Automated Radar ServiceTAS, True Air SpeedTATCA, Terminal Air Traffic Control AutomationTAVT, Terminal Airspace Visualization ToolTCA, Terminal Control AreaTCA, Traffic Control Airport or Tower Control AirportTCACCIS, Transportation Coordinator Automated Command and Control Information SystemTCAS, Traffic Alert And Collision Avoidance SystemTCC, DOT Transportation Computer CenterTCCC, Tower Control Computer ComplexTCE, Tone Control EquipmentTCLT, Tentative Calculated Landing TimeTCO, Telecommunications Certification OfficerTCOM, Terminal CommunicationsTCS, Tower Communications SystemTDLS, Tower Data-Link ServicesTDMUX, Time Division Data MultiplexerTDPC, Touchdown/Positioning CircleTDWR, Terminal Doppler Weather RadarTELCO, Telephone CompanyTELMS, Telecommunications Management SystemTERPS, Terminal Instrument ProceduresTFAC, To FacilityTH, ThresholdTIMS, Telecommunications Information Management SystemTIPS, Terminal Information Processing SystemTL, TaxilaneTLOF, Touchdown and Liftoff AreaTM&O, Telecommunications Management and OperationsTMA, Traffic Management AdvisorTMC, Traffic Management CoordinatorTMC/MC, Traffic Management Coordinator/Military CoordinatorTMCC, Terminal Information Processing SystemTMCC, Traffic Management Computer ComplexTMF, Traffic Management FacilityTML, Television Microwave LinkTMLI, Television Microwave Link IndicatorTMLR, Television Microwave Link RepeaterTMLT, Television Microwave Link TerminalTMP, Traffic Management ProcessorTMS, Traffic Management SystemTMSPS, Traffic Management SpecialistsTMU, Traffic Management UnitTNAV, Terminal Navigational AidsTODA, Takeoff Distance AvailableTOF, Time Of FlightTOFMS, Time of Flight Mass SpectrometerTOPS, Telecommunications Ordering and Pricing System (GSA software tool)TORA, Take-off Run AvailableTR, Telecommunications RequestTRACAB, Terminal Radar Approach Control in Tower CabTRACON, Terminal Radar Approach Control FacilityTRAD, Terminal Radar ServiceTRB, Transportation Research BoardTRNG, TrainingTSA, Taxiway Safety AreaTSEC, Terminal Secondary Radar ServiceTSP, Telecommunications Service PriorityTSR, Telecommunications Service RequestTSYS, Terminal Equipment SystemsTTMA, TRACON Traffic Management AdvisorTTY, TeletypeTVOR, Terminal VHF Omnidirectional RangeTW, TaxiwayTWEB, Transcribed Weather BroadcastTWR, Tower (non-controlled)TY, Type (FAACIS)UAS, Uniform Accounting SystemUHF, Ultra High FrequencyURA, Uniform Relocation Assistance and Real Property Acquisition Policies Act of 1970USAF, United States Air ForceUSC, United States CodeUSOC, Uniform Service Order CodeVALE, Voluntary Airport Low EmissionVASI, Visual Approach Slope IndicatorVDME, VOR with Distance Measuring EquipmentVF, Voice FrequencyVFR, Visual Flight RulesVGSI, Visual Glideslope IndicatorVHF, Very High FrequencyVLF, Very Low FrequencyVMC, Visual Meteorological ConditionsVNAV, Visual Navigational AidsVNTSC, Volpe National Transportation System CenterVON, Virtual On-netVOR, VHF Omnidirectional RangeVOR/DME, VHF Omnidirectional Range/Distance Measuring EquipmentVORTAC, VOR collocated with TACANVOT, VOR Test FacilityVP/D, Vehicle/Pedestrian DeviationVRS, Voice Recording SystemVSCS, Voice Switching and Control SystemVTA, Vertex Time of ArrivalVTAC, VOR collocated with TACANVTOL, Vertical Takeoff and LandingVTS, Voice Telecommunications SystemWAAS, Wide Area Augmentation SystemWAN, Wide Area NetworkWC, Work CenterWCP, Weather Communications ProcessorWECO, Western Electric CompanyWESCOM, Western Electric Satellite CommunicationsWHA, Wildlife Hazard AssessmentWHMP, Wildlife Hazard Management PlanWMSC, Weather Message Switching CenterWMSCR, Weather Message Switching Center ReplacementWSCMO, Weather Service Contract Meteorological ObservatoryWSFO, Weather Service Forecast OfficeWSMO, Weather Service Meteorological ObservatoryWSO, Weather Service OfficeWTHR, WeatherWX, Weather